[
  {
    "history_id": "example-ward-2026",
    "contest_id": "local.example.example-ward.2026-05-07",
    "area_id": "ward-example-2024",
    "area_code": "E05000000",
    "area_name": "Example Ward",
    "boundary_version_id": "ward-example-2024",
    "election_date": "2026-05-07",
    "election_type": "borough",
    "voting_system": "fptp",
    "source_snapshot_id": "example-election-result-2026-05-07",
    "source_url": "https://www.example.gov.uk/elections/results",
    "electorate": 4000,
    "turnout_votes": 1600,
    "turnout": 0.4,
    "review_status": "quarantined",
    "result_rows": [
      {
        "candidate_or_party_name": "Example Candidate",
        "party_name": "Example Party",
        "votes": 900,
        "vote_share": 0.5625,
        "rank": 1,
        "elected": true,
        "incumbent": false
      },
      {
        "candidate_or_party_name": "Another Candidate",
        "party_name": "Another Party",
        "votes": 700,
        "vote_share": 0.4375,
        "rank": 2,
        "elected": false,
        "incumbent": true
      }
    ]
  }
]
